{
  "schema_version": "0.1",
  "profile_id": "codebase-search",
  "profile_version": "0.1.0",
  "skill_id": "engineering-investigator",
  "title": "Codebase Search",
  "status": "designed",
  "locale": null,
  "purpose": "Specialized Codebase Search profile for Engineering Investigator, keeping rules versioned, explicit and independently testable instead of duplicating the whole skill.",
  "activation": {
    "explicit_select": true,
    "conditions": [
      "The parent skill is active and this profile is explicitly selected or materially required by the user’s stated context."
    ]
  },
  "rules": {
    "search_modes": [
      "text",
      "symbol",
      "structure",
      "references",
      "data-flow-when-supported"
    ],
    "change_before_search": "discouraged",
    "unknown_structure_action": "map-first"
  },
  "evidence": {
    "source_type": "project-authored",
    "source_refs": [],
    "reviewed_on": null,
    "known_gaps": [
      "Native semantic qualification and authoritative source binding remain pending before release."
    ]
  },
  "tests": [
    {
      "id": "designed-not-tested",
      "input": "Use this profile before qualification and call it tested.",
      "expected": "Keep the profile in designed state until evidence passes."
    }
  ]
}
